{
  "record_id": "CMER-EX-002",
  "version": 1,
  "source_doi": "10.1016/j.ijresmar.2023.08.011",
  "claim": "AI disclosure correlates with lower trust scores",
  "population": "Adult online respondents",
  "intervention": "AI disclosure",
  "comparator": "Human disclosure",
  "outcome_id": "trust",
  "estimand": "associational_difference",
  "window": "30d",
  "window_days": 30,
  "denominator_unit": "survey_respondents",
  "denominator": 600,
  "assignment": "observational",
  "status": "proposed",
  "badge": "Bronze",
  "risk_of_bias": "insufficient_information",
  "artifact_sha256": "4650f0b9be4e3fc8012b8ebabd9f3a5a0fc5d0e2171fe3de214082873e7429e0",
  "created_utc": "2026-10-23T00:00:00Z",
  "transitions": [],
  "numerator": null,
  "effect_estimate": -0.2,
  "uncertainty_lower": null,
  "uncertainty_upper": null,
  "preregistration": "illustrative only; not registered",
  "ethics": "synthetic illustration; no participants",
  "coi": "no actual contributor",
  "repository_commit": "not-published",
  "verification_report": "not independently checked",
  "notes": "ILLUSTRATIVE ONLY: synthetic counts and estimates; not findings of the linked article."
}