{
  "record_id": "CMER-EX-001",
  "version": 1,
  "source_doi": "10.1016/j.chb.2024.108549",
  "claim": "Personalization increases seven-day purchase probability",
  "population": "Adult online shoppers",
  "intervention": "Personalized recommendations",
  "comparator": "Generic recommendations",
  "outcome_id": "conversion_7d",
  "estimand": "ITT",
  "window": "7d",
  "window_days": 7,
  "denominator_unit": "eligible_randomized_users",
  "denominator": 1000,
  "assignment": "randomized",
  "status": "proposed",
  "badge": "Bronze",
  "risk_of_bias": "insufficient_information",
  "artifact_sha256": "f767b03bf8e3cd766af93eacbb5725b93bdb1dbdd9ab81e7c5d7da3d1be1af10",
  "created_utc": "2026-10-23T00:00:00Z",
  "transitions": [],
  "numerator": 40,
  "effect_estimate": 0.01,
  "uncertainty_lower": null,
  "uncertainty_upper": null,
  "preregistration": "illustrative only; not registered",
  "ethics": "synthetic illustration; no participants",
  "coi": "no actual contributor",
  "repository_commit": "not-published",
  "verification_report": "not independently checked",
  "notes": "ILLUSTRATIVE ONLY: synthetic counts and estimates; not findings of the linked article."
}